{
  "$schema": "https://json-schema.org/draft/2020-12/schema",
  "$id": "https://tura.ai/schemas/benchmark/agent-round.schema.json",
  "title": "Agent round contract",
  "description": "One reconstructed agent batch. Each JSONL line in agent-rounds.jsonl validates against this schema. A batch may aggregate adjacent assistant messages and tool calls only when source IDs establish that they belong to the same turn/batch.",
  "type": "object",
  "properties": {
    "schema": { "type": "string", "pattern": "^tura\\.benchmark\\.(agent-)?round\\.v1$", "description": "Round contract discriminator. Both historical round.v1 and current agent-round.v1 are accepted." },
    "id": { "type": "string", "description": "Canonical round ID in the consolidated Tura form." },
    "roundId": { "type": "string", "description": "Canonical round ID in the detailed provider reconstruction form." },
    "index": { "type": "integer", "minimum": 1, "description": "One-based round index in consolidated form." },
    "roundIndex": { "type": "integer", "minimum": 1, "description": "One-based round index in detailed form." },
    "title": { "type": "string", "description": "Short display title such as Agent round 3." },
    "intent": { "type": "string", "description": "Source/reconstruction intent used to explain how this batch was formed." },
    "startedAt": { "$ref": "common.schema.json#/$defs/timestamp", "description": "Round start time when a trustworthy event exists." },
    "endedAt": { "$ref": "common.schema.json#/$defs/timestamp", "description": "Round end time when a trustworthy event exists." },
    "batch": {
      "type": ["object", "null"],
      "description": "Evidence that multiple source events were merged into one displayed batch.",
      "properties": {
        "id": { "type": "string", "description": "Stable batch ID." },
        "sourceRoundIds": { "type": "array", "description": "Ordered source round/turn IDs included in the batch.", "items": { "type": "string" } },
        "certainty": { "type": "string", "description": "Grouping evidence label. Values such as exact, inferred, or collector-same-round must be explained by the producer." }
      },
      "required": ["id", "sourceRoundIds", "certainty"],
      "additionalProperties": true
    },
    "input": {
      "type": "object",
      "description": "Input context sent into this round when preserved.",
      "properties": {
        "messages": { "type": "array", "items": { "$ref": "common.schema.json#/$defs/message" }, "description": "Input messages attributable to this boundary." },
        "fullContext": { "type": "string", "description": "Complete recovered context. Empty when the provider log did not expose it." }
      },
      "additionalProperties": true
    },
    "output": {
      "type": "object",
      "description": "Complete assistant output for this round.",
      "properties": {
        "fullOutput": { "type": "string", "description": "Complete serialized output for archival inspection." },
        "assistantMessage": { "type": "string", "description": "Complete assistant-authored message with Markdown and line breaks preserved." },
        "messages": { "type": "array", "items": { "$ref": "common.schema.json#/$defs/message" }, "description": "Structured output messages." }
      },
      "additionalProperties": true
    },
    "messages": { "type": "array", "description": "Display-order user/assistant/system messages for the batch.", "items": { "$ref": "common.schema.json#/$defs/message" } },
    "commands": { "type": "array", "description": "Commands and tool calls belonging to the same verified batch.", "items": { "$ref": "common.schema.json#/$defs/command" } },
    "toolCalls": { "type": "array", "description": "Detailed-form alias for complete tool calls.", "items": { "$ref": "common.schema.json#/$defs/command" } },
    "usage": { "$ref": "common.schema.json#/$defs/nullableTokenUsage", "description": "Per-round usage only when directly supported by source data. Null members are accepted for archived rounds and must not be rendered as numeric values." },
    "providerDurationMs": { "type": ["number", "null"], "minimum": 0, "description": "Provider request duration attributable to this round." },
    "sources": {
      "type": "object",
      "description": "Relative artifact paths used to reconstruct this round.",
      "properties": {
        "stdoutPath": { "type": ["string", "null"], "description": "Agent stdout JSONL path." },
        "providerCallsPath": { "type": ["string", "null"], "description": "Provider-call JSONL path." },
        "providerLogPath": { "type": ["string", "null"], "description": "Original provider log path when retained." },
        "summaryPath": { "type": ["string", "null"], "description": "Normalized run summary path." }
      },
      "additionalProperties": true
    },
    "metadata": { "type": "object", "description": "Source IDs, model facts, grouping evidence, and reconstruction provenance. Custom fields are allowed here.", "additionalProperties": true }
  },
  "required": [],
  "anyOf": [
    { "required": ["id", "index"] },
    { "required": ["roundId", "roundIndex"] }
  ],
  "additionalProperties": true
}
