{
  "schema": "tura.benchmark.round.v1",
  "id": "round-0015",
  "index": 15,
  "title": "Round 0015",
  "intent": "agent-round",
  "batch": {
    "id": "batch-0015",
    "sourceRoundIds": [
      "item_54"
    ],
    "certainty": "collector-same-round"
  },
  "usage": {
    "inputTokens": 82679,
    "cacheInputTokens": 81792,
    "outputTokens": 853,
    "totalTokens": 83532
  },
  "messages": [
    {
      "role": "assistant",
      "format": "markdown",
      "text": "I’m rerunning the same sweep after the operand-order fix, then I’ll add a few error and wrapper checks so `compile.sh` and the runnable command are both in good shape."
    }
  ],
  "commands": [
    {
      "id": "command-0041",
      "toolName": "shell_command",
      "type": "shell_command",
      "isCommandRun": true,
      "step": 41,
      "commandRunStep": null,
      "commandIndex": null,
      "providerToolCallId": null,
      "status": "completed",
      "commandLine": "\"C:\\\\Program Files\\\\PowerShell\\\\7\\\\pwsh.exe\" -Command \"@'\nimport subprocess, pathlib\nref=pathlib.Path('REFERENCE_BINARY.txt').read_text().strip(); exe=str(pathlib.Path('executable.cmd').resolve())\ncases=[\n ['rust-reference/tests/itest','--color=never','--icons=never'],\n ['--long','rust-reference/tests/itest','--color=never','--icons=never'],\n ['--long','--no-user','--no-time','--no-filesize','rust-reference/tests/itest','--color=never','--icons=never'],\n ['--tree','rust-reference/tests/itest','--color=never','--icons=never'],\n ['--tree','--level=2','rust-reference/tests/itest','--color=never','--icons=never'],\n ['--sort=size','rust-reference/tests/itest','--color=never','--icons=never'],\n ['--sort=extension','rust-reference/tests/itest','--color=never','--icons=never'],\n ['--reverse','rust-reference/tests/itest','--color=never','--icons=never'],\n ['--group-directories-first','rust-reference/tests/itest','--color=never','--icons=never'],\n ['--long','--header','tmp_probe','--color=never','--icons=never'],\n ['--only-dirs','tmp_probe','--color=never','--icons=never'],\n ['--only-files','tmp_probe','--color=never','--icons=never'],\n ['-a','tmp_probe','--color=never','--icons=never'],\n ['-aa','tmp_probe','--color=never','--icons=never'],\n ['tmp_probe','rust-reference/tests/itest','--color=never','--icons=never'],\n ['--long','tmp_probe','rust-reference/tests/itest','--color=never','--icons=never'],\n ['--tree','tmp_probe','rust-reference/tests/itest','--color=never','--icons=never'],\n ['tmp_probe/file10','tmp_probe/A.txt','--color=never','--icons=never'],\n ['--sort=size','tmp_probe/b.txt','tmp_probe/A.txt','--color=never','--icons=never'],\n ['no-such-file','--color=never','--icons=never'],\n ['--bad'],\n ['--sort=colour'],\n]\nfor args in cases:\n r=subprocess.run([ref,*args],capture_output=True); p=subprocess.run([exe,*args],capture_output=True)\n ok=(r.returncode==p.returncode and r.stdout==p.stdout and (r.stderr==p.stderr or args[0]=='no-such-file'))\n print('OK' if ok else 'DIFF', args, r.returncode, p.returncode, len(r.stdout), len(p.stdout), len(r.stderr), len(p.stderr))\n if not ok:\n  print('REF OUT', r.stdout[:1200].decode('utf-8','replace'))\n  print('PY OUT', p.stdout[:1200].decode('utf-8','replace'))\n  print('REF ERR', r.stderr.decode('utf-8','replace'))\n  print('PY ERR', p.stderr.decode('utf-8','replace'))\n  break\n'@ | python -\"",
      "preview": "@'",
      "exitCode": 0,
      "receipt": "OK ['rust-reference/tests/itest', '--color=never', '--icons=never'] 0 0 95 95 0 0\nOK ['--long', 'rust-reference/tests/itest', '--color=never', '--icons=never'] 0 0 579 579 0 0\nOK ['--long', '--no-user', '--no-time', '--no-filesize', 'rust-reference/tests/itest', '--color=never', '--icons=never'] 0 0 227 227 0 0\nOK ['--tree', 'rust-reference/tests/itest', '--color=never', '--icons=never'] 0 0 863 863 0 0\nOK ['--tree', '--level=2', 'rust-reference/tests/itest', '--color=never', '--icons=never'] 0 0 602 602 0 0\nOK ['--sort=size', 'rust-reference/tests/itest', '--color=never', '--icons=never'] 0 0 95 95 0 0\nOK ['--sort=extension', 'rust-reference/tests/itest', '--color=never', '--icons=never'] 0 0 95 95 0 0\nOK ['--reverse', 'rust-reference/tests/itest', '--color=never', '--icons=never'] 0 0 95 95 0 0\nOK ['--group-directories-first', 'rust-reference/tests/itest', '--color=never', '--icons=never'] 0 0 95 95 0 0\nOK ['--long', '--header', 'tmp_probe', '--color=never', '--icons=never'] 0 0 184 184 0 0\nOK ['--only-dirs', 'tmp_probe', '--color=never', '--icons=never'] 0 0 4 4 0 0\nOK ['--only-files', 'tmp_probe', '--color=never', '--icons=never'] 0 0 25 25 0 0\nOK ['-a', 'tmp_probe', '--color=never', '--icons=never'] 0 0 34 34 0 0\nOK ['-aa', 'tmp_probe', '--color=never', '--icons=never'] 0 0 39 39 0 0\nDIFF ['tmp_probe', 'rust-reference/tests/itest', '--color=never', '--icons=never'] 0 0 164 164 0 0\nREF OUT tmp_probe:\nA.txt\nb.txt\ndir\nfile2\nfile10\n\nrust-reference/tests/itest:\na\nb\nc\nd\ndir-symlink\ne\nexa\nf\ng\nh\ni\nimage.jpg.img.c.rs.log.png\nindex.svg\nj\nk\nl\nm\nn\no\np\nq\nvagrant\n\nPY OUT tmp_probe:\nA.txt\nb.txt\ndir\nfile2\nfile10\n\nrust-reference/tests\\itest:\na\nb\nc\nd\ndir-symlink\ne\nexa\nf\ng\nh\ni\nimage.jpg.img.c.rs.log.png\nindex.svg\nj\nk\nl\nm\nn\no\np\nq\nvagrant\n\nREF ERR \nPY ERR",
      "stdout": "OK ['rust-reference/tests/itest', '--color=never', '--icons=never'] 0 0 95 95 0 0\nOK ['--long', 'rust-reference/tests/itest', '--color=never', '--icons=never'] 0 0 579 579 0 0\nOK ['--long', '--no-user', '--no-time', '--no-filesize', 'rust-reference/tests/itest', '--color=never', '--icons=never'] 0 0 227 227 0 0\nOK ['--tree', 'rust-reference/tests/itest', '--color=never', '--icons=never'] 0 0 863 863 0 0\nOK ['--tree', '--level=2', 'rust-reference/tests/itest', '--color=never', '--icons=never'] 0 0 602 602 0 0\nOK ['--sort=size', 'rust-reference/tests/itest', '--color=never', '--icons=never'] 0 0 95 95 0 0\nOK ['--sort=extension', 'rust-reference/tests/itest', '--color=never', '--icons=never'] 0 0 95 95 0 0\nOK ['--reverse', 'rust-reference/tests/itest', '--color=never', '--icons=never'] 0 0 95 95 0 0\nOK ['--group-directories-first', 'rust-reference/tests/itest', '--color=never', '--icons=never'] 0 0 95 95 0 0\nOK ['--long', '--header', 'tmp_probe', '--color=never', '--icons=never'] 0 0 184 184 0 0\nOK ['--only-dirs', 'tmp_probe', '--color=never', '--icons=never'] 0 0 4 4 0 0\nOK ['--only-files', 'tmp_probe', '--color=never', '--icons=never'] 0 0 25 25 0 0\nOK ['-a', 'tmp_probe', '--color=never', '--icons=never'] 0 0 34 34 0 0\nOK ['-aa', 'tmp_probe', '--color=never', '--icons=never'] 0 0 39 39 0 0\nDIFF ['tmp_probe', 'rust-reference/tests/itest', '--color=never', '--icons=never'] 0 0 164 164 0 0\nREF OUT tmp_probe:\nA.txt\nb.txt\ndir\nfile2\nfile10\n\nrust-reference/tests/itest:\na\nb\nc\nd\ndir-symlink\ne\nexa\nf\ng\nh\ni\nimage.jpg.img.c.rs.log.png\nindex.svg\nj\nk\nl\nm\nn\no\np\nq\nvagrant\n\nPY OUT tmp_probe:\nA.txt\nb.txt\ndir\nfile2\nfile10\n\nrust-reference/tests\\itest:\na\nb\nc\nd\ndir-symlink\ne\nexa\nf\ng\nh\ni\nimage.jpg.img.c.rs.log.png\nindex.svg\nj\nk\nl\nm\nn\no\np\nq\nvagrant\n\nREF ERR \nPY ERR",
      "stderr": ""
    }
  ]
}
