{
  "schema": "tura.benchmark.round.v1",
  "id": "round-0007",
  "index": 7,
  "title": "Round 0007",
  "intent": "agent-round",
  "batch": {
    "id": "batch-0007",
    "sourceRoundIds": [
      "item_18"
    ],
    "certainty": "collector-same-round"
  },
  "usage": {
    "inputTokens": 54598,
    "cacheInputTokens": 52608,
    "outputTokens": 229,
    "totalTokens": 54827
  },
  "messages": [
    {
      "role": "assistant",
      "format": "markdown",
      "text": "The repeated failure is specifically under the explicit `vinxi` install path.\n\nSince TanStack Start brings its build integration through its own package, I’m removing the direct `vinxi` dependency and letting Start own that transitive wiring."
    }
  ],
  "commands": [
    {
      "id": "command-0013",
      "toolName": "file_change",
      "type": "file_change",
      "isCommandRun": false,
      "step": 13,
      "commandRunStep": null,
      "commandIndex": null,
      "providerToolCallId": null,
      "status": "completed",
      "commandLine": "file_change\nupdate package.json",
      "preview": "file_change",
      "exitCode": null,
      "receipt": "update package.json",
      "stdout": "update package.json",
      "stderr": ""
    }
  ]
}
